{
  "type": "launch-explainer",
  "targetSeconds": 200,
  "tier": "m",
  "platforms": ["xhs-3x4"],
  "shortVersion": { "enabled": true, "targetSeconds": 75, "script": "auto-cut" },
  "persona": {
    "viewpoint": "普通用户 / 打工人视角：它能替我干什么、该信几分、该等还是该换",
    "voiceStyle": "青春活泼的大学生男生口吻，像在跟同学第一人称分享刚看到的新鲜事，语速快、有起伏、带着笑意和兴奋感，随意自然",
    "phrasebank": "worker"
  },
  "account": { "name": "你的账号名" },
  "theme": "neon",
  "mode": "template",
  "language": "zh-CN",
  "source": {
    "url": "https://openai.com/index/gpt-6-astra/",
    "title": "GPT-6 Astra: A new generation of intelligence",
    "fetchedAt": "2026-09-03T13:06:00-07:00",
    "kind": "url"
  },
  "generation": { "provider": "grok-cli", "allow": ["cover", "hook", "broll"] },
  "tts": {
    "provider": "seed2",
    "speaker": "zh_male_qingshuangnanda_uranus_bigtts",
    "rate": 28,
    "style": "青春活泼的大学生男生口吻，像在跟同学第一人称分享刚看到的新鲜事，语速快、有起伏、带着笑意和兴奋感，随意自然"
  },
  "notes": "角度：打工人视角（能替我干什么 / 该信几分 / 等还是换）。必须保留“没赢的地方”。竞品分数是 OpenAI 报告值，footer 里说明。不在画面上加 AI 生成标识（用户决定）。演示片段全部无声（hasAudio=false），字幕按原文撰写。Vimeo 主宣传片 403 未收录。"
}
